Title;Description;Show_type;runtime;Release_year;genres;imdb_score;imdb_votes;tmdb_popularity;tmdb_score
The Three Stooges;The Three Stooges were an American vaudeville and comedy team active from 1922 until 1970, best known for their 190 short subject films by Columbia Pictures that have been regularly airing on television since 1958. Their hallmark was physical farce and slapstick. In films, the stooges were commonly known by their actual first names. There were a total of six stooges over the act's run (with only three active at any given time), but Moe Howard and Larry Fine were the mainstays throughout the ensemble's nearly fifty-year run.;SHOW;19;1934;['comedy', 'family', 'animation', 'action', 'fantasy', 'horror'];8.6;1092;15.424;7.6
The General;During America’s Civil War, Union spies steal engineer Johnnie Gray's beloved locomotive, 'The General'—with Johnnie's lady love aboard an attached boxcar—and he single-handedly must do all in his power to both get The General back and to rescue Annabelle.;MOVIE;78;1926;['action', 'drama', 'war', 'western', 'comedy', 'european'];8.2;89766;8.647;8
The Best Years of Our Lives;It's the hope that sustains the spirit of every GI: the dream of the day when he will finally return home. For three WWII veterans, the day has arrived. But for each man, the dream is about to become a nightmare.;MOVIE;171;1946;['romance', 'war', 'drama'];8.1;63026;8.435;7.8
His Girl Friday;Hildy, the journalist former wife of newspaper editor Walter Burns, visits his office to inform him that she's engaged and will be getting remarried the next day. Walter can't let that happen and frames the fiancé, Bruce Baldwin, for one thing after another, to keep him temporarily held in prison, while trying to steer Hildy into returning to her old job as his employee.;MOVIE;92;1940;['comedy', 'drama', 'romance'];7.8;57835;11.27;7.4
In a Lonely Place;An aspiring actress begins to suspect that her temperamental boyfriend is a murderer.;MOVIE;94;1950;['thriller', 'drama', 'romance'];7.9;30924;8.273;7.6
Stagecoach;A group of people traveling on a stagecoach find their journey complicated by the threat of Geronimo, and learn something about each other in the process.;MOVIE;96;1939;['western', 'drama'];7.8;48149;11.786;7.7
It's a Wonderful Life;A holiday favourite for generations...  George Bailey has spent his entire life giving to the people of Bedford Falls.  All that prevents rich skinflint Mr. Potter from taking over the entire town is George's modest building and loan company.  But on Christmas Eve the business's $8,000 is lost and George's troubles begin.;MOVIE;130;1946;['drama', 'family', 'fantasy', 'romance', 'comedy'];8.6;444243;26.495;8.3
Detour;The life of Al Roberts, a pianist in a New York nightclub, turns into a nightmare when he decides to hitchhike to Los Angeles to visit his girlfriend.;MOVIE;66;1945;['thriller', 'drama', 'crime'];7.3;17233;7.757;7.2
My Man Godfrey;Fifth Avenue socialite Irene Bullock needs a "forgotten man" to win a scavenger hunt, and no one is more forgotten than Godfrey Park, who resides in a dump by the East River. Irene hires Godfrey as a servant for her riotously unhinged family, to the chagrin of her spoiled sister, Cornelia, who tries her best to get Godfrey fired. As Irene falls for her new butler, Godfrey turns the tables and teaches the frivolous Bullocks a lesson or two.;MOVIE;95;1936;['comedy', 'romance', 'drama'];8;23532;8.633;7.6
Marihuana;A young girl named Burma attends a beach party with her boyfriend and after she smokes marijuana with a bunch of other girls, she gets pregnant and another girl drowns while skinny dipping in the ocean. Burma and her boyfriend go to work for the pusher in order to make money so they can get married. However, during a drug deal her boyfriend is killed leaving Burma to fend for herself. Burma then becomes a major narcotics pusher in her own right after giving up her baby for adoption.;MOVIE;57;1936;['crime', 'drama'];4;864;3.748;3.6
Intolerance: Love's Struggle Throughout the Ages;The story of a poor young woman, separated by prejudice from her husband and baby, is interwoven with tales of intolerance from throughout history.;MOVIE;197;1916;['history', 'drama'];7.7;15242;9.412;7.2
The Stranger;A man working for the War Crimes Commission suspects that an important Nazi official has folded himself into a quaint Connecticut town.;MOVIE;95;1946;['thriller', 'crime', 'drama'];7.3;26293;7.566;7.3
The Phantom of the Opera;A grotesquely disfigured composer known as "The Phantom" haunts Paris' opera house, where he's secretly grooming Christine Daae to be an opera diva. Luring her to his remote underground lair, The Phantom declares his love. But Christine loves Raoul de Chagny and plans to elope with him. When The Phantom learns this, he abducts Christine.;MOVIE;101;1925;['horror'];7.5;18190;7.428;7.2
Tell Your Children;High-school principal Dr. Alfred Carroll relates to an audience of parents that marijuana can have devastating effects on teens: a drug supplier entices several restless teens, Mary and Jimmy Lane, sister and brother, and Bill, Mary's boyfriend, into frequenting a reefer house. Gradually, Bill and Jimmy are drawn into smoking dope, which affects their family lives.;MOVIE;66;1938;['drama', 'crime'];3.7;8617;5.412;4.1
The Most Dangerous Game;When legendary hunter Bob Rainsford is shipwrecked on the perilous reefs surrounding a mysterious island, he finds himself the guest of the reclusive and eccentric Count Zaroff. While he is very gracious at first, Zaroff eventually forces Rainsford and two other shipwreck survivors, brother and sister Eve and Martin Towbridge, to participate in a sadistic game of cat and mouse in which they are the prey and he is the hunter.;MOVIE;63;1932;['thriller', 'horror', 'action'];7.1;12203;8.828;7
Wuthering Heights;The Earnshaws are Yorkshire farmers during the early 19th Century. One day, Mr. Earnshaw returns from a trip to the city, bringing with him a ragged little boy called Heathcliff. Earnshaw's son, Hindley, resents the child, but Heathcliff becomes companion and soulmate to Hindley's sister, Catherine. After her parents die, Cathy and Heathcliff grow up wild and free on the moors and despite the continued enmity between Hindley and Heathcliff they're happy -- until Cathy meets Edgar Linton, the son of a wealthy neighbor.;MOVIE;104;1939;['drama', 'romance'];7.5;17956;12.336;7.3
The Woman in the Window;A seductive woman gets an innocent professor mixed up in murder.;MOVIE;99;1944;['drama', 'thriller', 'crime'];7.6;15909;6.018;7.5
Steamboat Bill, Jr.;The just out of college effete son of a no-nonsense steamboat captain comes to visit his father whom he's not seen since he was little.;MOVIE;70;1928;['drama', 'romance', 'family', 'action', 'comedy'];7.8;14499;7.754;7.7
The Little Foxes;The ruthless, moneyed Hubbard clan lives in, and poisons, their part of the deep South at the turn of the 20th century. Regina Giddons née Hubbard has her daughter under her thumb. Mrs. Giddons is estranged from her husband, who is convalescing in Baltimore and suffers from a terminal illness. But she needs him home, and will manipulate her daughter to help bring him back. She has a sneaky business deal that she's cooking up with her two elder brothers, Oscar and Ben. Oscar has a flighty, unhappy wife and a dishonest worm of a son. Will the daughter have to marry this contemptible cousin? Who will she grow up to be - her mother or her aunt? Or can she escape the fate of both?;MOVIE;115;1941;['romance', 'drama'];7.9;11775;5.906;7.5
Stella Dallas;After divorcing a society man, a small-town woman tries to build a better life for their daughter.;MOVIE;106;1937;['drama', 'romance'];7.4;5440;5.377;6.9
Dodsworth;A retired auto manufacturer and his wife take a long-planned European vacation only to find that they want very different things from life.;MOVIE;101;1936;['romance', 'drama'];7.8;9063;6.1;7.2
Sands of Iwo Jima;The relationship between Sergeant Stryker and a group of rebellious recruits is made difficult by the Sergeant's tough training tactics. At Tarawa, the leathernecks have a chance to see Stryker in action, and begin to appreciate him.;MOVIE;100;1950;['drama', 'war', 'action', 'romance'];7;10399;7.629;6.5
The Pride of the Yankees;The story of the life and career of the baseball hall of famer, Lou Gehrig.;MOVIE;128;1942;['drama', 'romance', 'sport'];7.6;10866;6.602;7.4
Things to Come;The story of a century: a decades-long second World War leaves plague and anarchy, then a rational state rebuilds civilization and attempts space travel.;MOVIE;89;1936;['scifi', 'drama', 'war'];6.6;7965;11.526;6.5
Cyrano de Bergerac;France, 1640: Cyrano, the charismatic swordsman-poet with the absurd nose, hopelessly loves the beauteous Roxane, she, in turn, confesses to Cyrano her love for the handsome but tongue-tied Christian. The chivalrous Cyrano sets up with Christian an innocent deception, with tragic results.;MOVIE;112;1950;['drama', 'romance'];7.4;4085;5.626;7.1
Scarlet Street;Cashier and part-time starving artist Christopher Cross is absolutely smitten with the beautiful Kitty March. Kitty plays along, but she's really only interested in Johnny, a two-bit crook. When Kitty and Johnny find out that art dealers are interested in Chris's work, they con him into letting Kitty take credit for the paintings. Cross allows it because he is in love with Kitty, but his love will only let her get away with so much.;MOVIE;103;1945;['thriller', 'drama'];7.8;16405;8.003;7.7
Made for Each Other;A couple struggle to find happiness after a whirlwind courtship.;MOVIE;92;1939;['comedy', 'drama', 'romance'];6.3;3582;6.242;6.1
The Thief of Bagdad;A recalcitrant thief vies with a duplicitous Mongol ruler for the hand of a beautiful princess.;MOVIE;149;1924;['romance', 'family', 'fantasy'];7.7;6134;7.166;7.4
D.O.A.;Frank Bigelow is about to die, and he knows it. The accountant has been poisoned and has only 24 hours before the lethal concoction kills him. Determined to find out who his murderer is, Frank, with the help of his assistant and girlfriend, Paula, begins to trace back over his last steps. As he frantically tries to unravel the mystery behind his own impending demise, his sleuthing leads him to a group of crooked businessmen and another murder.;MOVIE;83;1950;['crime', 'comedy', 'thriller', 'drama'];7.2;11816;7.932;6.9
Jungle Book;Rudyard Kipling's Jungle Book is given the full treatment in this lavish retelling filled with huge sets, exotic animals, a large cast and the incomparable Sabu, starring as Mowgli, the young orphan boy raised by wolves. Curious to reconnect with his human village, Mowgli returns only to find disappointment in the greed and treachery of man. Over time, Mowgli and the village members do grow to trust one another, but not before the village finds itself under siege. It's up to Mowgli and his jungle friends to save the day.;MOVIE;106;1942;['fantasy', 'family', 'action'];6.7;4195;6.515;6.3
Love Affair;French playboy Michel Marnet and American Terry McKay fall in love during the transatlantic passage of a ship. They arrange to reunite six months later, if neither has changed their mind.;MOVIE;88;1939;['romance', 'drama', 'comedy'];7.3;5421;4.028;7.3
The Bishop's Wife;An Episcopal Bishop, Henry Brougham, has been working for months on the plans for an elaborate new cathedral which he hopes will be paid for primarily by a wealthy, stubborn widow. He is losing sight of his family and of why he became a churchman in the first place. Enter Dudley, an angel sent to help him. Dudley does help everyone he meets, but not necessarily in the way they would have preferred. With the exception of Henry, everyone loves him, but Henry begins to believe that Dudley is there to replace him, both at work and in his family's affections, as Christmas approaches.;MOVIE;109;1947;['fantasy', 'comedy', 'drama', 'romance'];7.6;17675;9.031;7.1
Of Human Bondage;Club-footed medical school student Philip Carey falls in love with cynical waitress Mildred Rogers. She rejects him and runs off with a salesman, later returning pregnant and unmarried. Philip takes her in, though "happily ever after" is not to be.;MOVIE;83;1934;['drama', 'romance'];7;7332;5.776;6.6
Our Town;Change comes slowly to a small New Hampshire town in the early 20th century. We see birth, life and death in this small community.;MOVIE;90;1940;['romance', 'drama', 'family'];6.5;2607;2.847;5.6
The Little Princess;The classic Shirley Temple film in which a little girl goes in search of her father who is reported missing by the military during the Second Boer War.;MOVIE;93;1939;['comedy', 'drama', 'family'];7.1;6122;6.148;6.8
The Jackie Robinson Story;Biography of Jackie Robinson, the first black major league baseball player in the 20th century. Traces his career in the negro leagues and the major leagues.;MOVIE;76;1950;['drama', 'sport'];6.3;1272;1.957;6.4
The Secret Life of Walter Mitty;Walter Mitty, a daydreaming writer with an overprotective mother, likes to imagine that he is a hero who experiences fantastic adventures. His dream becomes reality when he accidentally meets a mysterious woman who hands him a little black book. According to her, it contains the locations of the Dutch crown jewels hidden since World War II. Soon, Mitty finds himself in the middle of a confusing conspiracy, where he has difficulty differentiating between fact and fiction.;MOVIE;105;1947;['romance', 'comedy', 'fantasy'];6.9;6307;5.415;6.8
The Strange Love of Martha Ivers;Three childhood friends, Martha, Walter and Sam, share a terrible secret. Over time, the ambitious Martha and the pusillanimous Walter have married. She is a cold businesswoman, he is the district attorney: a perfect combination to dominate the corrupt city of Iverstown at will. But the unexpected return of Sam, after years of absence, deeply disturbs the life of the odd couple.;MOVIE;115;1946;['thriller', 'romance', 'drama'];7.4;9729;9.703;7.2
Flying Tigers;Jim Gordon commands a unit of the famed Flying Tigers, the American Volunteer Group which fought the Japanese in China before America's entry into World War II. Gordon must send his outnumbered band of fighter pilots out against overwhelming odds while juggling the disparate personalities and problems of his fellow flyers.;MOVIE;102;1942;['drama', 'romance', 'war', 'action'];6.7;3917;3.238;6.1
Lady Windermere's Fan;A society woman believes her husband is having an affair, a misconception which may have dire personal consequences for all involved.;MOVIE;120;1925;['comedy'];7.2;1157;2.313;6.9
Dead End;Mobster "Baby Face" Martin returns home to visit the New York neighborhood where he grew up, dropping in on his mother, who rejects him because of his gangster lifestyle, and his old girlfriend, Francey, now a syphilitic prostitute. Martin also crosses paths with Dave, a childhood friend struggling to make it as an architect, and the Dead End Kids, a gang of young boys roaming the streets of the city's East Side slums.;MOVIE;93;1937;['crime', 'drama', 'romance'];7.3;7504;8.068;7.1
Meet John Doe;As a parting shot, fired reporter Ann Mitchell prints a fake letter from unemployed "John Doe," who threatens suicide in protest of social ills. The paper is forced to rehire Ann and hires John Willoughby to impersonate "Doe." Ann and her bosses cynically milk the story for all it's worth, until the made-up "John Doe" philosophy starts a whole political movement.;MOVIE;122;1941;['romance', 'comedy', 'drama'];7.6;13443;8.574;7.4
The Outlaw;Newly appointed sheriff Pat Garrett is pleased when his old friend Doc Holliday arrives in Lincoln, New Mexico on the stage. Doc is trailing his stolen horse, and it is discovered in the possession of Billy the Kid. In a surprising turnaround, Billy and Doc become friends. This causes the friendship between Doc and Pat to cool. The odd relationship between Doc and Billy grows stranger when Doc hides Billy at his girl Rio's place after Billy is shot.;MOVIE;116;1943;['western'];;;7.503;5.6
The Front Page;Hildy Johnson is an investigative reporter is looking for a bigger paycheck. When an accused murderer escapes from custody, Hildy sees an opportunity for the story of a lifetime. But when he finds the criminal, he learns that the man may not be guilty. With the help of his editor, Hildy attempts to hide the convict, uncover the conspiracy and write the scoop of his career.;MOVIE;101;1931;['comedy', 'drama', 'thriller', 'crime', 'romance'];6.2;17;5.403;6.6
White Zombie;In Haiti, a wealthy landowner convinces a sorcerer to lure the American woman he has fallen for away from her fiance, only to have the madman decide to keep the woman for himself, as a zombie.;MOVIE;67;1932;['horror'];6.3;10410;6.822;5.9
Bird of Paradise;When a young South Seas sailor falls overboard, the beautiful daughter of a Polynesian king dives in and saves his life. Thus begins the romance of Johnny and Luana. Though Luana is promised to another man, Johnny whisks her away, and for a brief time the lovers live very happily together. But, when a local volcano threatens their lives, Luana knows that she must sacrifice herself to the volcanic gods in order to save her island.;MOVIE;80;1932;['romance', 'drama'];6;1298;3.164;5
The Lost World;The first film adaptation of Sir Arthur Conan Doyle's classic novel about a land where prehistoric creatures still roam.;MOVIE;93;1925;['fantasy', 'thriller', 'scifi'];7;5185;8.026;6.7
49th Parallel;In the early days of World War II, a German U-boat is sunk in Canada's Hudson Bay. Hoping to evade capture, a small band of German soldiers led by commanding officer Lieutenant Hirth attempts to cross the border into the United States, which has not yet entered the war and is officially neutral. Along the way, the German soldiers encounter brave men such as a French-Canadian fur trapper, Johnnie, a leader of a Hutterite farming community, Peter, an author, Philip and a soldier, Andy Brock.;MOVIE;123;1941;['thriller', 'war', 'drama'];7.3;6716;8.475;7
The Private Life of Henry VIII;Renowned for his excess, King Henry VIII goes through a series of wives during his rule. With Anne Boleyn, his second wife, executed on charges of treason, King Henry weds maid Jane Seymour, but that marriage also ends in tragedy. Not one to be single for long, the king picks German-born Anne of Cleves as his bride, but their union lasts only months before an annulment is granted, and King Henry continues his string of spouses.;MOVIE;90;1933;['history', 'comedy', 'drama', 'romance'];7;4297;5.268;6.4
The Southerner;Sam Tucker, a cotton picker, in search of a better future for his family, decides to grow his own cotton crop. In the first year, the Tuckers battle disease, a flood, and a jealous neighbor. Can they make it as farmers?;MOVIE;92;1945;['drama'];7.1;3443;3.753;6.3
Hangmen Also Die!;During the Nazi occupation of Czechoslovakia, surgeon Dr. Franticek Svoboda, a Czech patriot, assassinates the brutal "Hangman of Europe", Reichsprotektor Reinhard Heydrich, and is wounded in the process. In his attempt to escape, he is helped by history professor Stephen Novotny and his daughter Mascha.;MOVIE;134;1943;['thriller', 'war', 'drama'];7.4;5442;6.772;7
A Farewell to Arms;A tale of the World War I love affair, begun in Italy, between American ambulance driver Lt. Frederic Henry and British nurse Catherine Barkley. Eventually separated by Frederic's transfer, tremendous challenges and difficult decisions face each as the war rages on.;MOVIE;89;1932;['drama', 'romance', 'war'];6.4;5970;7.581;6.3
The Scarlet Letter;In the seventeenth century, in Massachusetts, a young woman is forced to wear a scarlet "A" on her dress for bearing a child out of wedlock.;MOVIE;69;1934;['drama', 'history', 'romance'];5.3;367;1.666;4
The Hunchback of Notre Dame;In 15th century France, a gypsy girl is framed for murder by the infatuated Chief Justice, and only the deformed bellringer of Notre Dame Cathedral can save her.;MOVIE;113;1923;['horror', 'drama', 'romance'];7.2;5387;5.431;6.5
Tabu;The youngsters Matahi and Reri are in love with each other. The old warrior Hitu announces that Reri is to be the new chosen virgin for the gods. This means she must stay untouched, otherwise she and her lover will be killed. But Matahi abducts and escapes with her to an island ruled by the white man, where their gods would be harmless and powerless.;MOVIE;86;1931;['drama', 'romance', 'action'];7.4;5783;7.156;7.3
The Big Lift;The Berlin Air Lift from the point of view of two NCOs.;MOVIE;120;1950;['drama', 'war'];6.5;1550;2.667;6.7
Why We Fight: Prelude to War;Prelude to War was the first film of Frank Capra's Why We Fight propaganda film series, commissioned by the Pentagon and George C. Marshall. It was made to convince American troops of the necessity of combating the Axis Powers during World War II. This film examines the differences between democratic and fascist states.;MOVIE;53;1942;['documentation', 'war'];7;2194;3.877;6.6
The Fighting Kentuckian;John Breen (John Wayne), a Kentucky militiaman falls in love with French exile Fleurette De Marchand (Vera Ralston). He discovers a plot to steal the land that Fleurette's exiles plan to settle on and aims to foil it.;MOVIE;100;1949;['western', 'war', 'romance'];6.4;3260;7.146;5.8
Santa Fe Trail;As a penalty for fighting fellow classmates days before graduating from West Point, J.E.B. Stuart, George Armstrong Custer and four friends are assigned to the 2nd Cavalry, stationed at Fort Leavenworth. While there they aid in the capture and execution of the abolitionist, John Brown following the Battle of Harper's Ferry.;MOVIE;110;1940;['western', 'war', 'drama', 'history', 'romance'];6.2;3754;5.925;5.8
Dick Tracy;Detective Tracy (Morgan Conway) rescues Tess Trueheart (Anne Jeffreys) and Junior from a killer called Splitface (Mike Mazurki).;MOVIE;61;1945;['action', 'crime', 'thriller', 'family'];5.9;1380;2.627;5.1
Woman on the Run;Frank Johnson, a sole witness to a gangland murder, goes into hiding and is trailed by Police Inspector Ferris, on the theory that Frank is trying to escape from possible retaliation. Frank's wife, Eleanor, suspects he is actually running away from their unsuccessful marriage. Aided by a newspaperman, Danny Leggett, Eleanor sets out to locate her husband. The killer is also looking for him, and keeps close tabs on Eleanor.;MOVIE;77;1950;['drama', 'crime', 'thriller'];7.2;3901;4.814;6.8
Life with Father;A straitlaced turn-of-the-century father presides over a family of boys and the mother who really rules the roost.;MOVIE;118;1947;['comedy', 'family'];7.1;5446;4.151;6.4
Nothing Sacred;When a small-town girl is diagnosed with a rare, deadly disease, an ambitious newspaper man turns her into a national heroine.;MOVIE;77;1937;['romance', 'drama', 'fantasy', 'comedy'];6.9;6570;4.764;6.3
Penny Serenade;While listening to a recording of Penny Serenade, Julie Gardiner Adams begins reflecting on her past. She recalls her impulsive marriage to newspaper reporter Roger Adams, which begins on a deliriously happy note but turns out to be fraught with tragedy. Other songs remind her of their courtship, their marriage, their desire for a child, and the joys and sorrows they have shared. A flood of memories come back to her as she ponders on their present problems and how they arose.;MOVIE;119;1941;['romance', 'drama'];7.1;7087;5.767;6.8
He Walked by Night;This film-noir piece, told in semi-documentary style, follows police on the hunt for a resourceful criminal who shoots and kills a cop.;MOVIE;79;1949;['thriller', 'crime'];7.1;5943;5.253;6.7
Algiers;Pepe Le Moko is a notorious thief, who escaped from France. Since his escape, Moko became a resident and leader of the immense Casbah of Algiers. French officials arrive insisting on Pepe's capture are met with unfazed local detectives, led by Inspector Slimane, who are biding their time. Meanwhile, Pepe meets the beautiful Gaby , which arouses the jealousy of Ines;MOVIE;96;1938;['drama', 'romance'];6.7;2803;2.472;6.7
Louisiana Story;The idyllic life of a young Cajun boy and his pet raccoon is disrupted when the tranquility of the bayou is broken by an oil well drilling near his home.;MOVIE;78;1948;['drama'];6.6;1895;2.775;6.8
Jack London;The adventurous and remarkable life of the US writer Jack London (1876-1916).;MOVIE;94;1943;['drama', 'war', 'romance'];5.1;389;2.022;5.8
Broken Blossoms;The love story of an abused English girl and a Chinese Buddhist in a time when London was a brutal and harsh place to live.;MOVIE;89;1919;['romance', 'drama'];7.3;10230;6.012;6.9
Dr. Jekyll and Mr. Hyde;A doctor's research into the roots of evil turns him into a hideous depraved fiend.;MOVIE;79;1920;['horror', 'scifi', 'drama'];6.9;5367;8.16;7
The Pleasure Garden;Patsy Brand is a chorus girl at the Pleasure Garden music hall. She meets Jill Cheyne who is down on her luck and gets her a job as a dancer. Jill meets adventurer Hugh Fielding and they get engaged, but when Hugh travels out of the country, she begins to play around.;MOVIE;75;1925;['romance', 'drama'];5.8;2504;3.871;5.4
Too Late for Tears;One night on a lonely highway, a speeding car tosses a satchel of money, meant for somebody else, into Jane and Alan Palmer's back seat. Alan wants to turn it over to the police, but Jane persuades him to hang onto it 'for a while'. Soon, the Palmers are traced by one Danny Fuller, a sleazy character who claims the money is his.;MOVIE;99;1949;['crime', 'thriller', 'drama'];7.3;4678;5.145;6.9
Trapped;U.S. Treasury Department agents go after a ring of counterfeiters.;MOVIE;78;1949;['thriller', 'crime', 'drama'];6.4;1352;2.876;5.8
Mother;A  story about a family torn apart by a worker's strike. At first, the mother wants to protect her family from the troublemakers, but eventually she realizes that her son is right and the workers should strike.;MOVIE;89;1926;['drama'];7.5;2785;4.756;7.3
