Title;Description;Show_type;runtime;Release_year;genres;imdb_score;imdb_votes;tmdb_popularity;tmdb_score
A Fistful of Dynamite;At the beginning of the 1913 Mexican Revolution, greedy bandit Juan Miranda and idealist John H. Mallory, an Irish Republican Army explosives expert on the lam from the British, fall in with a band of revolutionaries plotting to strike a national bank. When it turns out that the government has been using the bank as a hiding place for illegally detained political prisoners -- who are freed by the blast -- Miranda becomes a revolutionary hero against his will.;MOVIE;157;1971;['western', 'european', 'drama', 'war'];7.6;34186;8.774;7.8
Capricorn One;In order to protect the reputation of the American space program, a team of scientists stages a phony Mars landing. Willingly participating in the deception are a trio of well-meaning astronauts, who become liabilities when their space capsule is reported lost on re-entry. Now, with the help of a crusading reporter, they must battle a sinister conspiracy that will stop at nothing to keep the truth.;MOVIE;123;1977;['thriller', 'action', 'drama'];6.8;22430;10.205;6.8
Great Performances;The best in the performing arts from across America and around the world including a diverse programming portfolio of classical music, opera, popular song, musical theater, dance, drama, and performance documentaries.;SHOW;116;1971;['drama', 'comedy'];;;27.555;6.7
The Big Country;Retired wealthy sea captain Jim McKay arrives in the vast expanse of the West to marry fiancée Pat Terrill. McKay is a man whose values and approach to life are a mystery to the ranchers and ranch foreman Steve Leech takes an immediate dislike to him. Pat is spoiled, selfish and controlled by her wealthy father, Major Henry Terrill. The Major is involved in a ruthless civil war, over watering rights for cattle, with a rough hewn clan led by Rufus Hannassey. The land in question is owned by Julie Maragon and both Terrill and Hannassey want it.;MOVIE;165;1958;['drama', 'western', 'romance', 'documentation', 'action'];7.9;17860;12.531;7.6
X: The Man with the X-Ray Eyes;A doctor uses special eye drops to give himself x-ray vision, but the new power has disastrous consequences.;MOVIE;79;1963;['horror', 'scifi', 'thriller'];6.6;7039;8.427;6.5
Piranha;When flesh-eating piranhas are accidently released into a summer resort's rivers, the guests become their next meal.;MOVIE;94;1978;['horror', 'comedy', 'scifi', 'thriller'];5.9;21459;39.684;5.9
Semi-Tough;A three-way friendship between two free-spirited professional football players and the owner's daughter becomes compromised when two of them become romantically involved.;MOVIE;108;1977;['romance', 'comedy', 'sport'];5.9;3069;3.951;5.5
The Little Shop of Horrors;Seymour works in a skid row florist shop and is in love with his beautiful co-worker, Audrey. He creates a new plant that not only talks but cannot survive without human flesh and blood.;MOVIE;70;1960;['horror', 'comedy'];6.2;17933;6.376;6.2
Gardeners' World;Gardeners' World is a long-running BBC Television programme about gardening, first broadcast in 1968 and still running as of 2013. Its first episode was presented by Ken Burras and came from Oxford Botanical Gardens. The magazine BBC Gardeners' World is a tie-in to the programme. Most of its episodes have been 30 minutes in length, although there are many specials that last longer. The 2008 and 2009 series used a 60-minute format.;SHOW;54;1968;['documentation'];8.3;243;10.063;8.5
Little Big Man;Jack Crabb, looking back from extreme old age, tells of his life being raised by Indians and fighting with General Custer.;MOVIE;139;1970;['western', 'comedy', 'drama'];7.6;35050;9.815;7.6
Exodus;Based on Leon Uris' novel, this historical epic provides a dramatic backstory to the creation of the state of Israel in 1948, in the aftermath of World War II. Ari Ben Canaan (Paul Newman), a passionate member of the Jewish paramilitary group Haganah, attempts to transport 600 Jewish refugees on a dangerous voyage from Cyprus to Palestine on a ship named the Exodus. He faces obstruction from British forces, who will not grant the ship passage to its destination.;MOVIE;208;1960;['action', 'drama', 'history', 'war'];6.7;9830;7.432;6.7
The 36th Chamber of Shaolin;The anti-Ching patriots, under the guidance of Ho Kuang-han, have secretly set up their base in Canton, disguised as school masters. During a brutal Manchu attack, Lui manages to escape, and devotes himself to learning the martial arts in order to seek revenge.;MOVIE;115;1978;['action', 'drama'];7.7;16167;8.916;7.5
Diff'rent Strokes;The series stars Gary Coleman and Todd Bridges as Arnold and Willis Jackson, two African American boys from Harlem who are taken in by a rich white Park Avenue businessman named Phillip Drummond and his daughter Kimberly, for whom their deceased mother previously worked. During the first season and first half of the second season, Charlotte Rae also starred as the Drummonds' housekeeper, Mrs. Garrett.;SHOW;25;1978;['drama', 'comedy', 'family'];6.6;11238;1.597;7.1
Futureworld;Two years after the Westworld tragedy in the Delos amusement park, the corporate owners have reopened the park following over $1 billion in safety and other improvements. For publicity purposes, reporters Chuck Browning and Tracy Ballard are invited to review the park. Just prior to arriving at the park, however, Browning is given a clue by a dying man that something is amiss.;MOVIE;104;1976;['thriller', 'scifi'];5.7;10670;11.496;6
The Dogs of War;Mercenary James Shannon, on a reconnaissance job to the African nation of Zangaro, is tortured and deported. He returns to lead a coup.;MOVIE;118;1980;['thriller', 'action', 'drama', 'war'];6.3;8401;8.729;5.6
Belladonna of Sadness;An evil feudal lord rapes a village girl on her wedding night and proceeds to ruin her and her husband's lives. After she's eventually banished from her village, the girl makes a pact with the devil to gain magical ability and take revenge.;MOVIE;86;1973;['animation', 'horror', 'drama', 'fantasy'];7.3;5853;14.2;7.5
The Train;As the Allied forces approach Paris in August 1944, German Colonel Von Waldheim is desperate to take all of France's greatest paintings to Germany. He manages to secure a train to transport the valuable art works even as the chaos of retreat descends upon them. The French resistance however wants to stop them from stealing their national treasures but have received orders from London that they are not to be destroyed. The station master, Labiche, is tasked with scheduling the train and making it all happen smoothly but he is also part of a dwindling group of resistance fighters tasked with preventing the theft. He and others stage an elaborate ruse to keep the train from ever leaving French territory.;MOVIE;133;1964;['thriller', 'war', 'european'];7.8;16178;10.311;7.5
The Longest Yard;In this rough-and-tumble yarn, actually filmed on-location at the Georgia State Prision, the cons are the heroes and the guards are the heavies. Eddie Albert is the sadistic warden who'll gladly make any sacrifice to push his guards' semi-pro football team to a national championship.;MOVIE;118;1974;['crime', 'drama', 'comedy', 'sport'];7.1;18648;9.723;6.8
Battle of Britain;In 1940, the Royal Air Force fights a desperate battle against the might of the Luftwaffe for control of the skies over Britain, thus preventing the Nazi invasion of Britain.;MOVIE;132;1969;['action', 'drama', 'history', 'war'];6.9;22389;9.004;6.8
Thunderbolt and Lightfoot;With the help of an irreverent young sidekick, a bank robber gets his old gang back together to organise a daring new heist.;MOVIE;115;1974;['crime', 'comedy', 'drama'];7;25038;11.355;6.7
Rowan & Martin's Laugh-In;An American sketch comedy television program hosted by comedians Dan Rowan and Dick Martin.;SHOW;56;1968;['comedy', 'music'];8;3090;7.815;7.2
The Gumby Show;Innovative "Claymation" adventures of Gumby and his horse Pokey.;SHOW;13;1955;['comedy', 'family', 'fantasy', 'animation'];7;1493;4.508;5.2
10 Rillington Place;The story of British serial killer John Christie, who committed most or all of his crimes in the titular terraced house, and the miscarriage of justice involving Timothy Evans.;MOVIE;106;1971;['crime', 'thriller', 'drama'];7.5;8668;7.531;7.2
Coffy;After her younger sister gets involved in drugs and is severely injured by contaminated heroin, a nurse sets out on a mission of vengeance and vigilante justice, killing drug dealers, pimps, and mobsters who cross her path.;MOVIE;90;1973;['thriller', 'action', 'crime'];6.8;11229;7.395;6.8
The Last Tycoon;Monroe Stahr, a successful movie producer, pursues a beautiful and elusive young woman — all the while working himself to death.;MOVIE;123;1976;['drama', 'romance'];6.3;8760;7.564;6.4
The Danny Thomas Show;Danny Thomas, an entertainer, tries to balance his home life with the needs of his career, with hilarious results.;SHOW;30;1953;['comedy', 'family'];7.1;1073;7.891;6.3
House on Haunted Hill;Frederick Loren has invited five strangers to a party of a lifetime. He is offering each of them $10,000 if they can stay the night in a house. But the house is no ordinary house. This house has a reputation for murder. Frederick offers them each a gun for protection. They all arrived in a hearse and will either leave in it $10,000 richer or leave in it dead!;MOVIE;75;1959;['horror', 'crime'];6.8;26748;10.581;6.8
King Kong;In this remake of the 1933 classic, an oil company expedition disturbs the peace of a giant ape and brings him back to New York to exploit him.;MOVIE;134;1976;['fantasy', 'horror'];5.9;32259;20.724;6.2
Messiah of Evil;A young woman searching for her missing artist father finds herself in the strange seaside town of Point Dune, which seems to be under the influence of a mysterious undead cult.;MOVIE;90;1973;['horror'];6.4;4234;4.456;6.4
Investigation of a Citizen Above Suspicion;Rome, Italy. After committing a heinous crime, a senior police officer exposes evidence incriminating him because his moral commitment prevents him from circumventing the law and the social order it protects.;MOVIE;111;1970;['drama', 'thriller', 'european', 'crime'];8;11130;8.996;8.2
Route 66;Route 66 is an American TV series in which two young men traveled across America in a Chevrolet Corvette sports car. The show ran weekly on Fridays on CBS from October 7, 1960 to March 20, 1964. It starred Martin Milner as Tod Stiles and, for the first two and a half seasons, George Maharis as Buz Murdock. Maharis was ill for much of the third season, during which time Tod was shown traveling on his own. Tod met Lincoln Case, played by Glenn Corbett, late in the third season, and traveled with him until the end of the fourth and final season. The series currently airs on Me-TV, My Family TV and RTV.  Among the series more notable aspects were the featured Corvette convertible, and the program's instrumental theme song, which became a major pop hit.;SHOW;51;1960;['drama'];7.8;1697;7.797;6.2
Barabbas;Epic account of the thief Barabbas, who was spared crucifixion when Pilate manipulated the crowd into pardoning him, rather than Jesus. Struggling with his spirituality, Barabbas goes through many ordeals leading him to the gladiatorial arena, where he tries to win his freedom and confront his inner demons, ultimately becoming a follower of the man who was crucified in his place.;MOVIE;137;1961;['drama', 'history', 'european'];6.9;6359;11.912;7
The Endless Summer;Bruce Brown's The Endless Summer is one of the first and most influential surf movies of all time. The film documents American surfers Mike Hynson and Robert August as they travel the world during California’s winter (which, back in 1965 was off-season for surfing) in search of the perfect wave and ultimately, an endless summer.;MOVIE;95;1966;['documentation', 'sport'];7.6;5582;5.435;7.3
Trilogy of Terror;A horror anthology containing three stories: a female college professor is aggressively pursued by one of her students; a prudish brunette determines that her free-spirited blonde sister is evil; and a woman's night turns upside down after she purchases an ancient Zuni fetish doll.;MOVIE;72;1975;['horror', 'thriller'];6.5;7295
Beat the Devil;The script, which was written on a day-to-day basis as the film was being shot, concerns the adventures of a motley crew of swindlers and ne'er-do-wells trying to lay claim to land rich in uranium deposits in Kenya as they wait in a small Italian port to travel aboard an ill-fated tramp steamer en route to Mombasa.;MOVIE;89;1953;['comedy', 'action', 'crime', 'drama', 'romance'];6.4;9130;7.103;6.4
The Shootist;Afflicted with a terminal illness John Bernard Brooks, the last of the legendary gunfighters, quietly returns to Carson City for medical attention from his old friend Dr. Hostetler. Aware that his days are numbered, the troubled man seeks solace and peace in a boarding house run by a widow and her son. However, it is not Brooks' fate to die in peace, as he becomes embroiled in one last valiant battle.;MOVIE;100;1976;['western', 'drama', 'romance'];7.6;24207;10.583;7.2
The Pajama Game;Employees of the Sleeptite Pajama Factory are looking for a whopping seven-and-a-half cent an hour increase and they won't take no for an answer. Babe Williams is their feisty employee representative but she may have found her match in shop superintendent Sid Sorokin. When the two get together they wind up discussing a whole lot more than job actions! Written by A.L. Beneteau;MOVIE;101;1957;['comedy', 'drama', 'romance'];6.7;3639;3.28;6.7
The Lucy Show;The Lucy Show is an American sitcom that aired on CBS from 1962–68. It was Lucille Ball's follow-up to I Love Lucy. A significant change in cast and premise for the 1965–66 season divides the program into two distinct eras, aside from Ball, only Gale Gordon, who joined the program for its second season, remained. For the first three seasons, Vivian Vance was the co-star.  The earliest scripts were entitled The Lucille Ball Show, but when this title was declined, producers thought of calling the show This Is Lucy or The New Adventures of Lucy, before deciding on the title The Lucy Show. Ball won consecutive Emmy Awards as Outstanding Lead Actress in a Comedy Series for the series' final two seasons, 1966–67 and 1967–68.;SHOW;30;1962;['comedy'];7.2;2797;8.858;7.5
Foxy Brown;A voluptuous black woman takes a job as a high-class prostitute in order to get revenge on the mobsters who murdered her boyfriend.;MOVIE;94;1974;['crime', 'thriller', 'action'];6.5;10327;8.153;6.3
Jabberwocky;A medieval tale with Pythonesque humour: After the death of his father the young Dennis Cooper goes to town where he has to pass several adventures. The town and the whole kingdom is threatened by a terrible monster called 'Jabberwocky'. Will Dennis make his fortune? Is anyone brave enough to defeat the monster?;MOVIE;105;1977;['fantasy', 'comedy'];6.2;14629;9.622;6.1
Planet of the Vampires;In the near future the two spaceships Argos and Galliot are sent to investigate the mysterious planet Aura. As the Galliot lands on the planet her crew suddenly go berserk and attack each other. The strange event passes, but the crew soon discovers the crashed Argos - and learns that her crew died fighting each other! Investigating further, the explorers come to realize the existence of a race of bodiless aliens that seek to escape from their dying world.;MOVIE;88;1965;['scifi', 'horror', 'european', 'family', 'action'];6.2;5983;6.12;6.6
The Earthling;Recently diagnosed with a terminal illness, a man returns home to Australia to die in the wildness. His plans become complicated when he meets a young boy and decides to take him under his wing.;MOVIE;97;1980;['action', 'drama'];6.9;1615;2.952;6.7
The King of Marvin Gardens;Jason Staebler lives on the Boardwalk and fronts for the local mob in Atlantic City. He is a dreamer who asks his brother David, a radio personality from Philadelphia, to help him build a paradise on a Pacific Island, which might be just another of his pie-in-the-sky schemes. Inevitably, complications begin to pile up.;MOVIE;103;1972;['drama'];6.5;5464;5.532;6
Downhill Racer;An ambitious young skier, determined to break all existing records, is contemptuous of the teamwork advocated by the US coach when they go to Europe for the Olympics.;MOVIE;102;1969;['drama', 'sport'];6.3;4816;8.553;6
The Donna Reed Show;The Donna Reed Show is an American situation comedy starring Donna Reed as the upper-middle-class housewife Donna Stone. Carl Betz co-stars as her pediatrician husband Dr. Alex Stone, and Shelley Fabares and Paul Petersen as their teenage children, Mary and Jeff. The show originally aired on ABC from September 24, 1958 to March 19, 1966. When Fabares left the show in 1963, Petersen's little sister, Patty Petersen, joined the cast as adopted daughter Trisha. Patty Petersen had first appeared in the episode, "A Way of Her Own", on January 31, 1963.  Bob Crane and Ann McCrea appeared in the last seasons as the Kelseys, friends of the Stones, and Darryl Richard became a near regular as Smitty, Jeff's best buddy. The show featured a variety of celebrity guests including Esther Williams as a famous dress designer, baseball superstars Don Drysdale and Willie Mays as themselves, teen heartthrob James Darren as a pop singer with the measles, canine superstar Lassie as herself, and young Jay North of CBS's Dennis the Menace.  The series was created by William S. Roberts and developed by Reed and her then husband, producer Tony Owen. Episodes revolved around typical family problems of the period such as firing a clumsy housekeeper, throwing a retirement bash for a colleague, and finding quality time away from the children. Edgy themes such as women's rights and freedom of the press were occasionally explored.;SHOW;30;1958;['comedy', 'family'];7.4;1616;21.518;6.3
Prophecy;When a dispute occurs between a logging operation and a nearby Native American tribe, Dr. Robert Verne and his wife, Maggie, are sent in to mediate. Chief John Hawks insists the loggers are poisoning the water supply, and, though company man Isley denies it, the Vernes can't ignore the strangely mutated wildlife roaming the woods. Robert captures a bear cub for testing and soon finds himself the target of an angry mutant grizzly.;MOVIE;102;1979;['horror', 'scifi', 'thriller'];5.5;5122;6.357;5.7
Damn Yankees;Film adaptation of the George Abbott Broadway musical about a Washington Senators fan who makes a pact with the Devil to help his baseball team win the league pennant.;MOVIE;111;1958;['fantasy', 'comedy', 'romance', 'sport'];7;3003;3.093;6.7
Cockfighter;A man who trains fighting cocks vows to remain silent until one of his birds wins a championship.;MOVIE;83;1974;['drama'];7;2280;2.515;6.2
My Name Is Nobody;Jack Beauregard, one of the greatest gunman of the Old West, only wants to retire in peace and move to Europe. But a young gunfighter, known as "Nobody", who idolizes Beauregard, wants him to go out in glory. So he arranges for Jack to face the 150-man gang known as The Wild Bunch and earn his place in history.;MOVIE;117;1973;['comedy', 'western', 'european'];7.3;26763;9.26;7.3
Boxcar Bertha;"Boxcar" Bertha Thompson, a transient woman in Arkansas during the violence-filled Depression of the early '30s, meets up with rabble-rousing union man "Big" Bill Shelly and the two team up to fight the corrupt railroad establishment.;MOVIE;88;1972;['drama', 'crime', 'romance'];6;9488;7.271;5.9
Fat City;Two men, working as professional boxers, come to blows when their careers each begin to take opposite momentum.;MOVIE;100;1972;['drama', 'sport'];7.2;9018;6.207;7.1
The Hospital;A suicidal doctor struggles to find meaning in his life while a murderer stalks the halls of his hospital.;MOVIE;103;1971;['comedy', 'drama'];7.1;6439;4.81;6.7
To All a Goodnight;A group of teenagers at a party find themselves being stalked by a maniacal killer in a Santa Claus costume.;MOVIE;87;1980;['horror', 'thriller'];4.6;1722;4.059;4.5
Fear and Desire;After their airplane crashes behind enemy lines, four soldiers must survive and try to find a way back to their battalion. However, when they come across a local peasant girl the horrors of war quickly become apparent.;MOVIE;62;1953;['drama', 'thriller', 'war', 'european'];5.4;11619;9.166;5.5
The Man with the Golden Arm;A junkie must face his true self to kick his drug addiction.;MOVIE;119;1955;['drama', 'crime', 'romance'];7.3;11120;7.926;7.2
McLintock!;Ageing, wealthy, rancher and self-made man, George Washington McLintock is forced to deal with numerous personal and professional problems. Seemingly everyone wants a piece of his enormous farmstead, including high-ranking government men, McLintock's own sons and nearby Native Americans. As McLintock tries to juggle his various adversaries, his wife—who left him two years previously—suddenly returns. But she isn't interested in George, she wants custody of their daughter.;MOVIE;127;1963;['western', 'romance', 'comedy'];7.1;14773;13.737;6.6
Where the Red Fern Grows;Where the Red Fern Grows is the heartwarming and adventurous tale for all ages about a young boy and his quest for his own red-bone hound hunting dogs.;MOVIE;97;1974;['family', 'drama'];6.9;3388;4.255;6.8
Deranged;A man living in rural Wisconsin takes care of his bed-ridden mother, who is very domineering and teaches him that all women are evil. After she dies he misses her, so a year later he digs her up and takes her home. He learns about taxidermy and begins robbing graves to get materials to patch her up, and inevitably begins looking for fresher sources of materials. Based closely on the true story of Ed Gein.;MOVIE;83;1974;['horror', 'thriller', 'drama'];6.4;5027;6.751;5.9
The World of Suzie Wong;A Hong Kong sex worker tries modeling and falls for the artist who's painting her.;MOVIE;126;1960;['drama', 'romance'];6.9;2412;2.81;6.7
The Wild Geese;A British multinational company seeks to overthrow a vicious dictator in central Africa. It hires a band of (largely aged) mercenaries in London and sends them in to save the virtuous but imprisoned opposition leader who is also critically ill and due for execution. Just when the team has performed a perfect rescue, the multinational does a deal with the vicious dictator leaving the mercenary band to escape under their own steam and exact revenge.;MOVIE;134;1978;['action', 'drama', 'thriller', 'war'];6.7;12895;11.167;6.9
The Ladies Man;After his girl leaves him for someone else, Herbert gets really depressed and starts searching for a job. He finally finds one in a big house which is inhabited by many, many women. Can he live in the same home with all these females?;MOVIE;95;1961;['comedy'];6.3;4092;6.205;6.4
The Haunted Palace;A warlock burned at the stake comes back and takes over the body of his great grandson to take his revenge on the descendents of the villages that burned him.;MOVIE;87;1963;['horror'];6.7;6869;7.216;6.6
Watermelon Man;Jeff Gerber, a racist insurance agent and fitness freak, lives in a typical suburban neighborhood. But Jeff's bigoted world of taunting and harassing black people on and off the job is turned upside down when his skin inexplicably turns dark overnight. As Jeff tries to come to terms with this unexplained phenomenon that has befallen him, he soon becomes the victim himself, when all of his friends and neighbors suddenly shun and harass him.;MOVIE;100;1970;['drama', 'comedy'];6.6;2418;2.968;6.2
The Hitch-Hiker;Roy and Gilbert's fishing trip takes a terrifying turn when the hitchhiker they pick up turns out to be a sociopath on the run from the law. He's killed before, and he lets the two know that as soon as they're no longer useful, he'll kill again. The two friends plot an escape, but the hitchhiker's peculiar physical affliction, an eye that never closes even when he sleeps, makes it impossible for them to tell when they can make a break for it.;MOVIE;71;1953;['thriller', 'crime', 'drama'];6.9;8806;6.337;6.8
Letter to Loretta;Letter to Loretta is an American anthology drama series telecast on NBC from September 1953 to June 1961 for a total of 165 episodes. The filmed show was hosted by Loretta Young who also played the lead in various episodes.  Letter to Loretta was sponsored by Procter & Gamble from 1953 through 1960. The final season's sponsor was Warner-Lambert's Listerine.;SHOW;30;1953;['drama'];7.7;253;2.477;6
Across 110th Street;In a daring robbery, some $300,000 is taken from the Italian mob. Several mafiosi are killed, as are two policemen. Lt. Pope and Capt. Mattelli are two New York City cops trying to break the case. Three small-time criminals are on the run with the money. Will the mafia catch them first, or will the police?;MOVIE;102;1972;['drama', 'thriller', 'action', 'crime'];7;6131;6.554;7
Lost Horizon;While escaping war-torn China, a group of Europeans crash in the Himalayas, where they are rescued and taken to the mysterious Valley of the Blue Moon, Shangri-La. Hidden from the rest of the world, Shangri-La is a haven of peace and tranquility for world-weary diplomat Richard Conway. However, his ambitious brother sees it as a prison from which he must escape, even if it means risking his life and bringing destruction to the ancient culture of Shangri-La.;MOVIE;150;1973;['fantasy', 'romance', 'drama'];5.2;2581;9.01;5.4
The Secret Invasion;During World War II, convicts are recruited by the Allies for an extremely hazardous mission.;MOVIE;95;1964;['drama', 'war', 'action', 'history'];5.9;1125;3.863;5.6
