Title;Description;Show_type;runtime;Release_year;genres;imdb_score;imdb_votes;tmdb_popularity;tmdb_score
That Brennan Girl;Raised by Natalie Brennan, a flamboyant and irresponsible mother, Ziggy Brennan gets involved in hustling men at a young age. She hangs around with a wild crowd and learns gets her "street smarts" first from her mother, who wants everyone to think they are sisters, and then from Denny Reagan, an older man. He starts teaching her his tricks of the trade and she falls right in line with his crooked ways. Then one night she meets Martin J. 'Mart' Neilson, a tall, handsome, honest farmer boy who's a sailor and they fall in love. While he's away fighting the war, she discovers she's pregnant.;MOVIE;95;1946;['drama', 'romance'];6.5;306;0.864;5.3
The Mystery of Mr. Wong;Detective James Lee Wong must find the "Eye of the Daughter of the Moon," a priceless but cursed sapphire stolen in China and smuggled to America. His search takes him into the heart of Chinatown and to the dreaded "House of Hate" to find the deadly gem before it can kill again.;MOVIE;68;1939;['thriller'];6.1;841;1.946;6.1
Smart Alecks;Danny helps to capture a wanted criminal and receives a $200 reward. However, he has a falling out with the gang when they believe he should share the money with them. Complications ensue when the crook that Danny helped capture escapes from jail and comes looking for him.;MOVIE;67;1942;['comedy', 'crime', 'drama', 'romance'];5.6;508;1.499;6
The Sphinx;A man known to be a mute is suspected of committing a murder, as he was noticed at the scene. However, witnesses saw and heard him talking as he was leaving the scene of the crime. The police must determine if he is the actual killer or if he is being framed.;MOVIE;64;1933;['thriller', 'drama', 'crime'];5.6;448;2.268;4.4
Gunsmoke Ranch;A crooked real estate manipulator sells worthless land on mortgage to flood refugees, then tries to profit by reselling the land to the state, committing murder in the process, as the Three Mesquiteers work to bring him and his gang to justice.;MOVIE;56;1937;['western', 'action', 'drama'];5.5;142;1.483;3.6
The Girl Who Came Back;A counterfeiter gives up her life of crime and goes straight. She gets a job in a bank, but the members of her former gang hear about it and try to blackmail her into helping them rob the bank.;MOVIE;65;1935;['crime', 'drama', 'romance'];5.7;60;1.211;
The Blazing Sun;Gene Autry hunts bank robbers Al Bartlett and Trot Lucas with his old friend Mike. Bartlett, to throw off his pursuers, kills Trot and his own brother. When Kitty Bartlett comes to town claiming to be the slain Bartlett's widow, Gene has to save her from the irate townspeople who are not aware that her name isn't Bartlett but she really is the daughter of a law officer slain by Al Bartlett. Ben Luder, a local hood, tricks Bartlett back into town by saying he has to fixed to have Doc Larry Taylor do plastic surgery on him. En route they meet Doc and his assistant Helen Ellis and Ben's ruse is exposed. Bartlett kills Ben and forces Doc to drive him to the railroad. Gene, in a fight atop a runaway train, captures Bartlett.;MOVIE;69;1950;['western', 'music', 'action'];6.1;103;0.84;
International Crime;The second and final Grand National Pictures film to feature The Shadow, played again by Rod La Rocque. In this version, Lamont Cranston is an amateur detective and host of a radio show with his assistant Phoebe (not Margo) Lane. Cabbie Moe Shrevnitz and Commissioner Weston also appear.;MOVIE;62;1938;['crime'];5.5;453;2.069;5.4
The Green Promise;A stubborn farmer is raising his children alone. When his oldest daughter gets a suitor, the father nearly goes on the rampage, but he is forced to change his tune when he is injured, leaving her in charge of the farm.;MOVIE;93;1949;['drama'];6.4;552;2.367;6.1
La Cucaracha;Señor Martinez, a famous theater owner, visits a local café in Mexico because of its reputation for good food and to audition the famous dancer who performs there. Martinez tells the café owner that if the dancer is as good as he has heard, he will offer the dancer a contract to perform in his theater. The café's female singer hears about this and is determined that he won't leave the café without her.;MOVIE;20;1934;['comedy'];;;1.059;5.1
The Ranger and the Lady;While Sam Houston in in the nation's capital trying to get Texas into the Union, his aide is trying to impose a self-serving tax on the use of the Santa Fe trail. The lady owner of a wagon train is using the trail, and a Texas Ranger comes to her assistance.;MOVIE;52;1940;['western', 'music'];6.4;108;1.441;
From the Manger to the Cross;The life of Jesus is played out in tableaux shot in the Holy Land.;MOVIE;71;1912;['drama'];5.8;588;1.235;5.3
The Last of the Clintons;Cowboy infiltrates an outlaw gang to expose their rackets, but after he's ordered to kidnap a young girl, the gang finds out who he really is.;MOVIE;59;1935;['western', 'action', 'romance'];5.8;91;1.576;5
Let's Get Tough;Rejected by the Army, Marines, and Navy for being too young, the punks help the war effort by throwing fruit at a shop they believe is owned by a Japanese American. Confronted by him wielding a short sword, the gang decides to come back at night but find him dead.;MOVIE;62;1942;['comedy', 'romance', 'action'];5.2;525;1.579;6.5
South of Santa Fe;To get the three needed business men to visit the Stevens mine, Roy stages a ride with the Vacaros and has them as honored guests. Seeing a chance to make a lot of money, gangster Harmon joins the ride and then has his men kidnap the three. Having filmed a fake holdup earlier, he uses the film to convince the Sheriff that Roy and the boys were the Kidnapers.;MOVIE;53;1942;['western', 'music', 'action'];6.3;110;1.915;5.3
In Old Colorado;Joe Weller has instigated a conflict over water rights between two ranchers. The idea is to have the ranchers do each other in then move in and take over. Hoppy and the good guys won't let this happen.;MOVIE;66;1941;['western', 'action'];6.5;185;1.248;6
Flirting with Danger;Three brash and cocky powder mixers are sent to South America to work at a dynamite plant there.;MOVIE;62;1934;['comedy'];5.2;34;0.628;
Texas Jack;Jack is looking for the man that was responsible for the death of his sister after he hired her as a school teacher. When he runs into school teacher Ann who was just hired by Corey, he soon realizes Corey is the man he is after. Lacking proof, he works on Corey's nerves hoping to get a confession from him.;MOVIE;55;1935;['western'];5.4;22;0.6;
The Married Virgin;In order to save her wealthy father from disgrace and a possible prison sentence, a daughter agrees to marry the gigolo who's been blackmailing him...;MOVIE;71;1918;['drama', 'romance'];5.4;662;0.837;5.6
Klondike Fury;In this Alaskan adventure, a surgeon becomes a pilot after he messes up an operation. Unfortunately, he crashes during a storm and finds himself cared for by a lovely woman. He gets a chance to reclaim his self-esteem when her son suddenly needs the same operation the surgeon botched.;MOVIE;68;1942;['drama', 'action', 'romance'];4.1;83;1.4;3.7
Lucky Terror;A sharpshooter in a traveling sideshow is falsely accused of murdering a local miner.;MOVIE;61;1936;['western', 'comedy', 'action'];6;71;0.84;5
Girls in Chains;A fired teacher (Arline Judge) finds work at a girls reform school and helps a detective (Roger Clark) on a case.;MOVIE;75;1943;['crime', 'drama'];4.6;233;1.331;4.3
Wolf Call;A spoiled New York playboy learns the values of life when he's sent by his father to work in a rural mining community in Canada.;MOVIE;62;1939;['romance', 'action', 'drama'];6;49;1.491;3
When the Lights Go On Again;The hometown life of a young soldier suffering from shellshock amnesia is revealed in flashback.;MOVIE;74;1944;['romance', 'war', 'drama'];5.7;33;1.132;5
Dixiana;A circus performer falls in love with the son of a plantation owner in antebellum New Orleans. When the young man's stepmother objects to the wedding, the couple has to decide if they can make their relationship work.;MOVIE;100;1930;['comedy', 'music', 'romance', 'drama'];5.2;372;1.212;5.1
The Love Light;Angela maintains a coastal lighthouse in Italy, where she awaits the return of her brothers from the war. She learns they are casualties and takes solace in the arms of an American sailor washed ashore. However, the sailor turns out to be a German spy, and she is torn between her love for him and her realization that he is part of the enemy force that has destroyed her family.;MOVIE;89;1921;['drama'];6.4;377;0.951;7.3
Young Dynamite;A young, newly-appointed rookie state trooper, John Shields, is celebrating with his sister Jane, his younger brother Freddie and Tom Marlin, Jane's fiancé and also a trooper, when they hear over the radio that two bandits have just killed a lawyer and his watchman. John and Tom set out in their patrol cars in hopes of capturing the killers, followed by Freddie who hopes some day to qualify as a trooper. Freddie encounters the two two bandits, Spike Doland and Butch and manages to get away with the bag of gold they had stolen. While chasing Freddie they are recognized by John who they kill when he tries to arrest them. Freddie then takes matters into his own hands in seeking to capture the killers of his brother.;MOVIE;57;1937;['crime', 'drama'];4.9;49;0.674;1
Madame Behave;A cross-dressing farce, adapted from "Madame Lucy" by Jean Arlette, in which to help a friend in a lawsuit, Jack Mitchell disguises himself as the mysterious "Madame Brown," a missing witness important to the case of the plaintiff. He attracts the romantic attention of two old roués and one hot Broadway showgirl.;MOVIE;55;1925;['comedy', 'romance'];6.8;28;0.6;5
Desperate Cargo;When two showgirls decide to leave South America and head for home, they sweet talk the purser of a clipper ship into giving them berths. In the course of the voyage, a band of thieves attempts to take over the ship and make off with its cash cargo. The heroic purser has other ideas and weighs in to save the day.;MOVIE;67;1941;['crime', 'romance', 'drama'];5.3;128;1.4;1
Diary of a Sergeant;Harold Russell, an American soldier who lost his hands in a training accident, tells the story of his medical rehabilitation at Walter Reed Army Medical Center in Washington DC, how he and his fellow amputees at the hospital at first despaired and then found new hope in the prostheses and training available to amputees through the Army's medical corps. Russell learns to wear and to operate the hooks which replace his hands and becomes competent to perform many tasks he had once thought no longer possible. Discharged from the Army, he is welcomed into Boston College by college president William J. Murphy, S.J.;MOVIE;22;1945;['documentation'];;;1.13;6
Sunset Serenade;Bad guys plot to trick a newly arrived Eastern girl out of a ranch which belongs to her infant ward. Roy, of course, saves the ranch for the girl. Songs include "I'm Headin's for the Home Corral," "He's a No Good Son of a Gun," "Sandman Lullaby," "Song of the San Joaquin," and "I'm a Cowboy Rockefeller.";MOVIE;60;1942;['western', 'music', 'action'];6.3;106;1.187;5.7
Paradise Canyon;John Wyatt is a government agent sent to smash a counterfeiting operation near the Mexican border. Joining Doc Carter's medicine show they arrive in the town where Curly Joe, who once framed Carter, resides.;MOVIE;52;1935;['western', 'action', 'music', 'crime'];5.1;909;2.64;4.8
My Dog Shep;An orphan boy on his way to live with his uncle picks up a stray dog, and the two become fast friends. However, the uncle doesn't want the dog, and when chickens are found dead, the uncle accuses the dog of killing them. The boy decides that it's time he and the dog hit the road so they run away, and meet up with an elderly man who also ran away from a home where he believed he wasn't wanted either.;MOVIE;62;1946;['drama'];5.8;75;1.671;6
Beau Revel;"Beau" Revel, "An Ince-Vance Special Paramount Picture," was introduced with the subtitle, "This is the story of a man who played at love, forgetting in his vain selfishness, the rules of Duty, even Decency—conceitedly 'wasting his manhood in a game unworthy of man.'" That is a precise definition of Lewis Stone as the title character, first shown having his nails trimmed, his shoes shined, and receiving a shave. His latest fancy is Alice (Kathleen Kirkham), a woman whose husband's drunkenness has given Beau an opening.;MOVIE;69;1921;['drama'];4.9;50;1.204;3
In the Money;When the chemical company owned by eccentric Professor Higginbottom files for bankruptcy, the formerly-affluent family loses its income. Levelheaded oldest daughter Lambie struggles to make ends meet but has trouble persuading her carefree, profligate siblings to cut down on their spending. Youngest brother Dick enters a motorcycle race to win $500, but crashes his bike on the speedway and is paralyzed. Shocked into reality by the tragedy, Lambie's younger sister Babs persuades ex-prizefighter Gunboat Bimms to enter the ring one last time in hopes of winning a purse that will pay for Dick's surgery.;MOVIE;66;1933;['comedy', 'drama'];5.2;33;1.094;
The Underdog;During WWII, a strong-willed 12-year-old boy tries to steer his vocationally and maritally confused father straight, at the same time striving to keep his honor while the gang in his new neighborhood bully him.;MOVIE;65;1943;['drama', 'romance', 'war'];5.9;43;0.6;
Rainbow Valley;John Martin is a government agent working under cover. Leading citizen Morgan calls in gunman Galt who blows Martin's cover.;MOVIE;52;1935;['western', 'action', 'romance'];5.3;655;3.407;4.6
Paradise Island;The south sea island Tonga is full of plantations and scoundrels. Ellen Bradford arrives expecting marriage to respectable and successful plantation owner only to find he is a drunk and gambler. Being the only white woman she is the desire of scoundrels and cut-throats.;MOVIE;68;1930;['romance', 'action', 'music'];5;116;1.732;3.3
Danny Boy;A U. S. Marines dog is returned to his young owner in the small town of Monrovia at the end of WWII, but a grouchy neighbor believes the animal's military training makes him a threat to the community and files charges to have the dog destroyed.;MOVIE;64;1945;['action', 'family', 'drama', 'war'];6.4;65;0.627;
Crimson Romance;After Fred von Bergen, a German immigrant in America, is forced from his job by anti-German hysteria before the first world war, he and his friend Bob Wilson leave America and join the German air force. There, both men fall in love with ambulance driver Alida Hoffman. When America enters the war, Bob is caught between loyalty to his home country and the threat of execution for desertion and treason to Germany. It remains for his friend Fred to extricate him from the dilemma - but at what cost?;MOVIE;71;1934;['drama', 'action', 'war'];5.6;174;1.71;
Little Tough Guy;The son of a man sentenced to death for a murder he didn't commit vows to become a criminal himself. He starts his own street gang, and their crime spree is financed by a mysterious young man--who turns out to be the son of the District Attorney who sent the boy's father to the electric chair.;MOVIE;86;1938;['crime', 'drama'];6.1;187;2.593;6.2
Kept Husbands;A former All-American football star, now working as a steel mill supervisor in New Jersey, falls in love with the mill owner's wealthy, very spoiled daughter.;MOVIE;76;1931;['drama', 'romance'];5.9;546;3.052;5.7
Beware Of Ladies;An unhappily married newspaper reporter discovers she's being used as a pawn in a scheme to discredit the political candidate she's been assigned to write about.;MOVIE;64;1936;['drama', 'romance', 'action', 'crime'];5.5;89;0.92;5
Silks and Saddles;Jockey Johnny Spencer loses his job with Mrs. Calhoun for throwing a race. An adventuress named Sybil, who made Johnny hold back Mrs. Calhoun's horse, Lady, leaves him, and he becomes a racetrack bum. Johnny returns to Mrs. Calhoun's stable when the new jockey proves unable to manage Lady. Johnny wins the next race, thereby regaining Mrs. Calhoun's confidence and winning the love of her attractive daughter, Lucy.;MOVIE;58;1929;['drama'];8.2;10;0.6;
Headline Crasher;The popular B-flick team of Frankie Darro and Kane Richmond star in the slick quickie Headline Crasher. Little Frankie and Big Kane play a pair of roving journalists who investigate a politician (Richard Tucker) up for re-election. When it seems as though the politico is being set up for a fall by yellow journalists, Darro and Richmond try to get to the truth of the matter. The original story for Headline Crasher is credited to Peter B. Kyne, creator of the "Broncho Billy" western stories.;MOVIE;58;1937;['romance', 'drama'];5.4;61;1.461;
Minesweeper;A naval officer who had deserted several years earlier is drawn back to the Navy when World War II begins. He re-enlists under an assumed name, and is assigned to a minesweeper, where he has to perform hazardous duties while at the same time keeping his real identity a secret.;MOVIE;67;1943;['drama', 'romance', 'war', 'action', 'comedy'];5.1;368;1.968;5
Young Romance;Two young clerks in a department store meet and fall in love during a seaside vacation in Maine, but part as strangers because, unknown to each other, both had been masquerading as upper-class 'swells', just to see how the better half lives.;MOVIE;59;1915;['comedy', 'romance'];5.8;186;0.709;6
Range War;Buck Colins heads a group of local ranchers who are trying to prevent the railroad from completing its line through their property. Till now they have been able to charge tolls on herds passing through. Hoppy goes undercover to expose them.;MOVIE;65;1939;['western'];6.7;151;0.922;
The World Gone Mad;A district attorney and a reporter try to find the killer of a D.A. who uncovered a massive stock fraud.;MOVIE;80;1933;['thriller', 'crime', 'drama'];4.8;529;2.6;4
Sepia Cinderella;A struggling songwriter (Billy Daniels) abandons his girlfriend (Sheila Guyse) for a flashy woman (Tondeleyo) after landing a hit.;MOVIE;75;1947;['romance', 'comedy'];5.7;117;0.681;5
The Hairy Ape;Aboard ship, a spoiled woman (Susan Hayward) insults the brutish stoker (William Bendix) while watching him work.;MOVIE;92;1944;['drama'];6.2;436;1.264;5.3
Hearts in Bondage;Best friends Kenneth Reynolds and Raymond Jordan are U.S. Navy officers, and Kenneth is engaged to Raymond's sister. But the eruption of the Civil War divides them, as Raymond stands by his native Virginia while Kenneth remains on duty as a Northern officer. Kenneth's uncle, John Ericsson, designs a new kind of ship, an ironclad he calls the Monitor. Eventually the war pits Kenneth, on board the Monitor, against his friend Raymond, serving aboard the South's own ironclad, the Merrimac (as it is called here). A naval battle ensues, one that will go down in history.;MOVIE;72;1936;['drama', 'war', 'history', 'romance'];5.5;210;1.4;4.2
The Phantom Broadcast;A handsome radio singer has it all--fame, money, adoring fans--but what no one knows is that his accompanist, a hunchbacked piano player, is actually the voice behind the arrogant, abusive "singer"'s fame. The two men fall for the same girl, and when the singer turns up dead, suspicion falls upon his assistant and the girl.;MOVIE;72;1933;['thriller', 'romance', 'crime', 'music'];5.5;142;0.6;5
Belle of the Yukon;Left by a con man, Belle De Valle, a dancer, finds him again in gold-rush Alaska running an honest casino/dance hall.;MOVIE;83;1944;['western', 'romance', 'comedy'];5.2;405;2.818;4.3
Danger Lights;Head railroad man Dan is as ugly as he is honorable. When he spots a drifter who'd hopped a freight held up by a landslide, Dan offers the man a job, then he finds the man was a railroader, too, and takes him under his wing. Engaged to Mary, Dan doesn't notice the growing attraction between his protégé and his intended, but focuses instead on running the railroad.;MOVIE;74;1930;['drama'];6.1;532;2.891;5.7
Rolling Home;An elderly rodeo rider, his young grandson and their injured horse help transform the lives of various citizens in a small town. Released in 1946.;MOVIE;71;1946;['western', 'drama', 'romance'];5.8;73;0.913;6
Renegade Trail;Hoppy goes to town to help Marshal Windy with some rustlers and winds up helping the widow Joyce when confidence men try to take her herd. King's Men songs include: "Hi Thar Stranger" and "Lazy Rolls the Rio Grande.";MOVIE;58;1939;['western', 'music'];6.7;157;0.627;
Tombstone Canyon;A range lawman (Ken Maynard) unmasks a black-cloaked phantom killer (Sheldon Lewis).;MOVIE;62;1932;['western'];5.4;179;1.096;3.5
The Stilwell Road;Documentary - Documentary about the construction of the Stilwell Road--originally called The Ledo Road--a 478-mile passage from Assam, India, to Ledo, Burma, during World War II. The road, which was built by 63,000 workers and cost $150 million, was used by the British, Chinese and Indian armies to transport supplies, troops and other essentials from India to Burma in order to keep the Japanese from overrunning the entire theater. -  Ronald Reagan, Harold Alexander, Claude Auchinleck;MOVIE;51;1945;['documentation', 'war'];6.4;81;0.6;
The Love of Sunya;A young woman at life's crossroads is granted mystic visions of how her decisions will affect her future life.;MOVIE;78;1927;['drama', 'romance'];6.3;810;1.234;7.2
East Side Kids;After living all his chilhood in the street, a young boy notices rapidly that crime doesn't pay and that´s why he decides to become a policeman. One day, one of his best friends go in prison for a murder he didn't commit. Immediately the policeman tries his best to release him and prove his innocence.;MOVIE;62;1940;['drama', 'thriller', 'comedy', 'romance'];5.5;256;0.781;7.3
Panhandle;An ex-gunfighter (Rod Cameron) woos two women while avenging his brother, victim of a crooked gambler.;MOVIE;85;1948;['western', 'action', 'drama', 'romance'];6.1;269;2.824;5.3
Clancy Street Boys;Muggs' rich Uncle Pete is coming to visit. Unfortunately, Muggs' late father had bragged that he had seven kids, so Muggs recruits the members of the gang to pose as his family. Things turn sour, however, when a local mobster finds out about Muggs' deception and threatens to expose it.;MOVIE;66;1943;['comedy', 'drama', 'action'];6;526;1.4;7.3
The Return of Casey Jones;Jimmy, a young boy, idolizes famed train engineer Casey Jones and is devastated when his hero is killed in a train wreck. The boy grows up to be a railroad engineer, too, but one day the train he is piloting loses its brakes and wrecks. Jimmy tries to fix it but has to jump off at the last minute. Unfortunately, stories begin to circulate that he turned coward and jumped off the train first, letting it be destroyed rather than try to save it. He sets out to clear his name.;MOVIE;61;1933;['drama', 'action'];5.2;37;1.171;
The Eye of Envy;In Sleepy Hollow dwells a young blacksmith who, when not happily making horseshoes, is courting a village maiden.;MOVIE;73;1917;['drama'];6.3;27;0.621;9
Barefoot Boy;A spoiled boy sent to the country to grow-up. He has to deal with life, friends and crooks.;MOVIE;63;1938;['action', 'family', 'thriller', 'crime', 'drama'];5.6;88;1.18;5.7
Kermit Maynard Collection (Whistling Bullets;Ace Beldon is in prison, but with his stolen bonds not recovered, Capt. Saunders has an idea. He sends Graham to prison and has him and Beldon break out. With Ranger Raymond assisting, they make their escape and get to the hangout run by Stone. But the plan starts to go awry when Sam overhears Graham talking with the Captain and reports back to Stone.;MOVIE;57;1937;['drama', 'action', 'western'];5.6;50;1.045;6
Flying Wild;A group of young men who work at an aviation factory begin to suspect that a doctor who runs an air ambulance service is secretly a spy transporting secret information from the plant to enemy agents.;MOVIE;64;1941;['thriller', 'comedy', 'drama', 'action'];5.4;498;2.355;6
Let's Go Collegiate;Rawley University is about to receive a star athlete who could give it the first championship rowing team it's ever had. Unfortunately, he gets drafted into the army before he's able to join the team. Two of the team's members get the bright idea of passing off a burly truck driver as the "athlete". Complications ensue.;MOVIE;62;1941;['romance', 'comedy', 'sport'];5;168;1.4;5
Curley;The students of Lakeview Elementary devise ways to torment their new teacher. Comedy.;MOVIE;53;1947;['comedy', 'family'];5.8;109;1.018;5.7
People Are Funny;A comedy based on NBC's "People Are Funny" radio (and later television) program with Art Linkletter with a fictional story of how the program came to be on a national network from its humble beginning at a Nevada radio station. Jack Haley is a producer with only half-rights to the program while Ozzie Nelson and Helen Walker are the radio writers and supply the romance. Rudy Vallee, always able to burlesque himself intentional and, quite often, unintentional, is the owner of the sought-after sponsoring company. Frances Langford, as herself, sings "I'm in the Mood for Love" while the Vagabonds quartet (billed 12th and last) chimes in on "Angeline" and "The Old Square Dance is Back Again.";MOVIE;93;1946;['comedy'];5.2;146;2.239;5
Men of the Plains;The Government sends Dean, Baxter, and Gordon to investigate a series of train holdups. Travis is behind the robberies and they are soon on his trail. When things get hot, Travis has a plan of double-crossing his own men that will enable him to keep not only his gold but also the money it is insured for.;MOVIE;62;1936;['western', 'action', 'romance'];5.1;39;0.6;
