Title;Description;Show_type;runtime;Release_year;genres;imdb_score;imdb_votes;tmdb_popularity;tmdb_score
The Billion Dollar Hobo;Vernon Praiseworthy is a clumsy but lovable dope who stands to inherit his uncle's fortune. The condition is that he travel the rails as a penniless hobo just as his uncle did in the dark days of the depression. That seems simple enough until he gets involved in a dog-napping plot. Written by Jerry Roberts;MOVIE;96;1977;['comedy', 'family'];4.3;309;1.438;6.4
I Eat Your Skin;A cancer researcher on a remote Caribbean island discovers that by treating the natives with snake venom he can turn them into bug-eyed zombies. Uninterested in this information, the unfortunate man is forced by his evil employer to create an army of the creatures in order to conquer the world.;MOVIE;84;1971;['horror'];3.5;1497;1.438;3.5
The Gatling Gun;Doctor Gatling invented a war machine to beat all arrows, and guns.;MOVIE;93;1971;['western', 'action', 'drama'];4.9;392;3.723;4.2
Stunts;After a stunt man dies while he is involved in the making of a motion picture, his brother takes his place in order to find out what really happened.;MOVIE;89;1977;['thriller', 'drama'];5.4;629;1.364;4
The River Niger;An intimate look at life in the ghetto: Johnny Williams is a house painter who moonlights as a poet, struggling to financially and emotionally support his cancer-ridden wife Mattie. But times are tough and the poverty-troubled streets are even tougher, and it takes every ounce of Johnny's love and courage for the couple to make it through their strife, finding redemption in the River Niger.;MOVIE;105;1976;['drama'];6;265;1.805;6
Against a Crooked Sky;The eldest daughter of a pioneer family is kidnapped by a mysterious Indian tribe and the eldest son pursues. In order to win back his sister's freedom, he must sacrifice his own life by passing the test of "Crooked Sky" and shield his sister from an executioner's arrow. Along the way, he recruits a broken down, drunk prospector to help him track down the unknown tribe and rescue his sister;MOVIE;89;1975;['western', 'family'];5.4;609;2.559;5.1
Take a Giant Step;This pioneering film in the history of African-American cinema, released two years before "A Raisin In The Sun", is the coming-of-age story of a Black high-school student living in a middle-class white neighborhood in the late '50s.;MOVIE;100;1959;['drama'];6.9;450;0.743;6
The Purple Plain;A RAF airfield in Burma in 1945, during World War II. Canadian bomber pilot Bill Forrester is a bitter man who lives haunted by a tragic past. He has became a reckless warrior, and is feared by his comrades, who consider him a madman. Dr. Harris, the squadron physician, is determined to help him heal his tormented soul.;MOVIE;98;1954;['drama', 'war', 'action'];6.5;2113;4.155;6.4
The Zoo;When Byomkesh Bakshi's new client, Dr. Nishanath Sen, is murdered at Golaap Colony, he decides to probe into the case with the help of his close aide, Ajit.;MOVIE;125;1967;['action', 'crime', 'drama', 'thriller'];7.3;958;1.173;5.8
The Californians;San Franciscans during the goldrush of the 1850s attempt to maintain law and order in their wild city. Newly arrived Matthew Wayne becomes sheriff, then marshal, and organizes the city police force while expressing interest in the young widow Fanzler and sparring with attorney Pitt. Adam Kennedy appears as Dion Patrick, an Irish newspaperman who helps the local vigilante committee.;SHOW;30;1957;['western'];7.2;99;3.94;
The Astral Factor;Demonstrating that a little knowledge is a dangerous thing, a convicted strangler studies the paranormal and finds a way to render himself invisible. Once he escapes, he sets out to find and eliminate the five women who testified in his prosecution. A police lieutenant (Robert Foxworth) sets out to safeguard them, and bring the invisible killer to justice.;MOVIE;96;1976;['horror', 'scifi', 'thriller', 'crime'];3.6;791;2.96;3.6
Flight from Ashiya;Featuring an all-star cast and on-location shooting in Japan, where the story is set, three US Air Force rescue pilots must overcome their personal problems and differences to embark upon a dangerous mission to save raft-bound Japanese survivors from a murderous storm-tossed sea. As they head for their location, the film flashes back to chronicle the pasts of each pilot to make clear their mixed feelings about their upcoming assignment.;MOVIE;100;1964;['romance', 'drama', 'war'];5.3;588;1.658;5.7
The Ambassador's Daughter;While on leave in Paris, a G.I. pursues an ambassador's daughter.  Meanwhile she's out to prove to her father that soldiers can be gentlemen, too.;MOVIE;103;1956;['comedy', 'romance'];5.9;694;2.132;4.3
Voyage to the Prehistoric Planet;In 2020, after the colonization of the moon, the spaceships Vega, Sirius and Capella are launched from Lunar Station 7. They are to explore Venus under the command of Professor Hartman, but an asteroid collides and explodes Capella. The leader ship Vega stays orbiting and sends the astronauts Kern and Sherman with the robot John to the surface of Venus, but they have problems with communication with Dr. Marsha Evans in Vega. The Sirius lands in Venus and Commander Brendan Lockhart, Andre Ferneau and Hans Walter explore the planet and are attacked by prehistoric animals. They use a vehicle to seek Kern and Sherman while collecting samples from the planet. Meanwhile John helps the two cosmonauts to survive in the hostile land.;MOVIE;78;1965;['fantasy', 'scifi'];3.8;1733;2.429;4.2
Games of Desire;The wife of the Swedish Ambassador of Greece becomes involved in a romantic triangle, but the man who comes between husband and wife has a preference for the husband.;MOVIE;90;1964;['drama'];5.4;54;0.658;
Gamera: Super Monster;As a massive alien craft heads to Earth to do evil, three good and powerful superwomen befriend a young boy who has a special connection to Gamera.  The alien Zanon launches a battery of familiar foes against Gamera, who might have to give the ultimate sacrifice to defeat the alien invader.;MOVIE;92;1980;['scifi', 'family', 'action'];3.7;877;3.838;6.3
Gun Fever;Luke Ram seeks revenge against the white renegade who lead a Sioux raiding party against his father's stagecoach way station, killing all the inhabitants except himself. He's joined by his mining partner, young Sam Weller, not realizing that they man they seek is Weller's father, in whose gang Sam rode as a young man.;MOVIE;83;1958;['western'];5.4;182;1.45;5.7
The Manster;A reporter is sent to interview a scientist working in his mountain laboratory.;MOVIE;72;1959;['horror', 'scifi'];5.3;1454;2.017;4.6
High-Ballin';When a rash of targeted hijackings threatens to derail the independent trucking business, rig driver "Iron" Duke and his visiting friend Rane put the brakes on the bad guys by taking the law into their own hands. But their vigilante plan involves going toe-to-toe with powerful trucker boss King Carroll and his henchmen, who've been driving everyone out of the game.;MOVIE;97;1978;['thriller', 'action', 'drama'];5.3;630;3.486;5.2
I Dream of Jeanie;The life and career of famed American composer Stephen Foster.;MOVIE;89;1952;['drama', 'comedy', 'music'];6;204;0.891;3.2
Gunsight Ridge;An undercover agent takes the job of sheriff in order to find the men responsible for a series of stagecoach robberies.;MOVIE;85;1957;['action', 'western', 'crime', 'romance'];6.3;588;1.721;5.8
Seed of Innocence;A love story about two teenagers who fall in love, have a child, and escape from their families in an attempt to make life for themselves in New York City.;MOVIE;91;1980;['drama'];5.3;72;1.296;5
The White Bus;A despondent young woman travels home to the North of England.;MOVIE;46;1967;['drama'];6.4;543;3.461;5.6
Pharaoh's Curse;Archaeologists in Egypt find one of their crew has been turned into a blood sucking mummy after they have unleashed a three thousand year curse.;MOVIE;66;1957;['horror'];4.7;622;2.694;4.3
The Alphabet Conspiracy;Dr. Frank Baxter, with the help of The Mad Hatter and Jabberwock, takes young Judy exploring the world of language, in which she finds out that language is for doing more than just talking.;MOVIE;60;1959;['animation', 'fantasy', 'family'];7.4;53;0.84;7
No. 1 of the Secret Service;No. 1 is fearless, irrestible, and licensed to kill. No. 1 is assigned to capture a madman killing international financiers. Before getting the bad guy, No. 1 encounters mercenaries from the evil organization K.R.A.S.H. (Killing, Rape, Arson, Slaughter, and Hit).;MOVIE;91;1978;['comedy', 'action'];4.6;181;2.562;5.3
Steel Arena;Dusty Russell shows off his talent as the greatest daredevil on the circuit. Later, he awaits the biggest challenge of his career.;MOVIE;98;1973;['action', 'drama', 'sport'];5.4;110;2.046;
The Expedition;The story revolves around a North Indian taxi driver, Narsingh, who attempts to reinvent his life by visiting his native place, but instead gets embroiled in a local Marwari businessman's smuggling and human trafficking business.;MOVIE;129;1962;['drama'];7.9;1208;2.726;7.4
Battle of Blood Island;Two American GIs are the only survivors of a unit wiped out in a battle with Japanese troops on an isolated island. The two, who don't like each other, find try to put aside their differences in order to evade the Japanese and survive.;MOVIE;64;1960;['drama', 'war'];4.7;260;1.407;5.1
The Bloody Vampire;Count Cagliostro, whose family has tried for generations to rid the world of vampires, instructs his daughter and her fiance to protect several valuable documents.;MOVIE;110;1962;['horror'];5.2;226;1.413;8.4
Mitzi & 100 Guys;Mitzi Gaynor in a song and dance hour with an all-male, star-studded ensemble featuring her main guests Michael Landon (Little House on the Prairie) and Jack Albertson (Chico and the Man), plus 28 celebrities as her "Million Dollar Chorus." Songs performed include: "I Got the Music in Me," "The Most Beautiful Guy in the World," and "You Are the Sunshine of My Life.";MOVIE;52;1975;['comedy', 'music'];8.2;24;1.518;
Goliath and the Dragon;A warrior returning home to his country must battle giant bats, three-headed dogs and a vicious dragon to save his wife, and his people, from the machinations of an evil ruler.;MOVIE;87;1960;['fantasy', 'romance', 'action'];5.2;514;3.122;5.3
The Wicked Dreams of Paula Schultz;A beautiful East German Olympic hopeful pole-vaults over the Berlin Wall to freedom.;MOVIE;113;1968;['comedy'];4.4;261;1.646;6
The Tell-Tale Heart;When Edgar sees his girlfriend Betty getting up close and personal with his best friend Carl, he murders Carl in a jealous rage and hides the corpse under the floor of his piano room. Comes the night, and Edgar begins to hear strange sounds coming from under the floor...;MOVIE;78;1960;['thriller', 'horror'];5.8;516;1.96;6.3
Mohawk;An artist working in a remote army post is juggling the storekeeper's daughter, his fiancée newly arrived from the east, and the Indian Chief's daughter. But when a vengeful settler manages to get the army and the braves at each other's throats his troubles really begin.;MOVIE;79;1956;['western', 'drama', 'romance'];5.2;534;4.517;6.1
The Revolutionary;"A", a member of a student protest organization, becomes disenchanted by his group's inability to effect real change. Emboldened to pursue more radical methods by the older, experienced leftist organizer Despard, "A" unwittingly becomes party to a labor strike that turns violent. Ultimately held responsible by the authorities for the fracas, "A" allies himself with terrorist Leonard, who intends to avenge those jailed in the protest.;MOVIE;100;1970;['drama', 'action'];5.5;264;1.996;5.4
Run for the Sun;Mike, a Hemingway-esque adventure novelist, is spending his days in a self-imposed exile somewhere in Central America. A reporter for Sight Magazine, Katie, has tracked him down in the hope of getting the biggest scoop of her career. Mike falls for Katie. On a flight to Mexico City, their plane crashes near a remote hideaway of Nazi war criminals in hiding. The Nazis want to stay hidden and plan to dispose of their new guests;MOVIE;99;1956;['thriller'];6.4;1307;1.774;5.9
Tarzan and the Trappers;Tarzan goes up against a villian by the name of Schroeder, who is trapping animals and selling them illegally to zoos. A twist is thrown into the plot when Schroeder's brother, with the help of money-hungry trader Lapin, hunts a different kind of quarry, human game. Now Tarzan must not only fight to save the animals of the jungle, but he must also save himself.;MOVIE;70;1958;['action'];4.9;592;4.115;4
Scream Baby Scream;A psycho artist kidnaps models and slices up their faces to create new mutant models.;MOVIE;83;1969;['horror'];4;241;1.021;3.5
The Mansion of Madness;The inmates of an insane asylum take over the institution, imprison the doctors and staff, and then put into play their own ideas of how the place should be run.;MOVIE;99;1973;['horror'];5;1040;1.418;4.7
Those Lips, Those Eyes;A small-town star helps a young apprentice land the girl of his dreams.;MOVIE;105;1980;['romance', 'comedy'];6.5;303;1.74;2
Katherine;A harrowing look at the 60s and early 70s through the eyes of Katherine Alman, a wealthy debutante who slowly, but inexorably spirals down into a fight for the causes that shook a nation, leading a path to the underground life. Written by Miguel Cane;MOVIE;97;1975;['drama'];6.1;373;1.398;5.3
New Faces;New Faces was a musical revue with songs and comedy skits tied together by a quirky plot. It ran on Broadway for nearly a year in 1952 and was then made into a motion picture in 1954. It helped jump start the careers of several young performers including Paul Lynde, Alice Ghostley, Eartha Kitt, Carol Lawrence, performer/writer Mel Brooks (as Melvin Brooks), and lyricist Sheldon Harnick. The film was basically a reproduction of the stage revue with a thin plot added. The plot involved a producer and performer (Ronny Graham) in financial trouble and is trying to stave off an angry creditor long enough to open his show. A wealthy Texan offers to help out, on the condition that his daughter be in the show.;MOVIE;98;1954;['comedy'];5.8;155;1.89;6.3
The Black Godfather;The heroes in The Black Godfather are members of an African-American criminal organization. Like Brando in The Godfather, they're not averse to robbery and murder, but they do draw the line at narcotics. When the Mafia infiltrates the 'hood with dangerous drugs, the Black Godfather (Rod Perry) orders his minions to put an end to this perfidy.;MOVIE;90;1974;['crime', 'thriller'];4.4;493;4.388;5
The Magnetic Monster;The Office of Scientific Investigations tracks down the source of increased magnetism and radioactivity in Los Angeles, and discovers that a man-made isotope is consuming available energy from nearby mass every few hours,  doubling its size in the process.  Although microscopic, it will soon become big enough to destroy Earth, and how to stop it is yet to be determined.  The film's Deltatron special effects footage is taken from the 1934 German sci-fi film GOLD.;MOVIE;76;1953;['scifi', 'horror'];5.8;1447;3.014;5.9
Cause for Alarm!;A bedridden and gravely ill man believes his wife and doctor are conspiring to kill him, and outlines his suspicions in a letter.;MOVIE;74;1951;['drama', 'crime', 'thriller'];6.4;2247;3.39;6.2
The Second Coming of Suzanne;Jared Martin plays an aspiring film maker obsessed with the idea of Christ as a woman, and tries to film his vision with Sondra Locke as his subject. 'Based' on a song by Leonard Cohen.;MOVIE;90;1974;['drama'];3.3;269;2.101;3.7
Kaala Patthar;Branded a coward for abandoning his ship full of 300 passengers, Captain Vijay Pal Singh takes up work in a distant coal mine, poorly equipped, with no sufficient medical supplies or proper facilities. When the miners and their families face a catastrophe, as water has forced its way into one of the mining tunnels, endangering 400 lives, will Vijay be able to rise to the occasion or will he 'abandon ship' again?;MOVIE;176;1979;['drama', 'thriller', 'history', 'action'];7.6;2400;1.115;6.8
Starblack;Starblack is a hero who dresses in black and his face is covered by a black scarf and he carries in his shirt a black star, which he always leaves at the scene of his enterprises, as a symbol of justice. Soucre: SWDB www.spaghetti-western.net;MOVIE;93;1966;['western', 'action'];5.6;214;1.077;6.5
Leo the Last;Prince Leo, last in the line of rulers of a long-deposed monarchy on continental Europe and jaded with the frenetic search for kicks with the European jet-set, returns to his father's London town house for rest.;MOVIE;104;1970;['drama', 'comedy'];5.9;601;2.717;4.7
Alice of Wonderland in Paris;Young Alice, having become a celebrity for her adventures in Wonderland, is in her bedroom dreaming about visiting Paris and sharing adventures with the storybook girl Madeline. While no comment is made as to where this Alice comes from or what time the film is set in, Alice seems to be American, as she likes Cheese Burgers and is having a great deal of trouble when it comes to getting to France. As Alice points out, “Getting to Wonderland was easy – all I had to do was fall down the rabbit hole. But let’s face it – it takes money to get to Paris!”.;MOVIE;52;1966;['fantasy', 'animation'];4.9;179;2.084;5.8
The Mark of the Hawk;The man called Obam struggles with the increasingly hostile forces facing each other in a colonial African country. The African natives want their land and lives back from the British colonists. Obam's motives are questioned by his own people, in particular his brother Kanda. With the help of his wife Renee and missionary Bruce Craig, will he be able to get things under control before the country self-destructs? Written by Greg Bruno;MOVIE;83;1957;['drama'];5.2;251;0.96;2
Girl Gang;A gangster hooks gangs of young women on drugs and has them commit robberies and prostitution.;MOVIE;63;1954;['thriller', 'crime', 'drama', 'action'];4.6;270;1.226;4.4
Shaan;DSP Shiv Kumar returns home to his wife Sheetal and their young daughter and announces that he has been transferred to Bombay. Shiv Kumar has two brothers, Vijay and Ravi, who live in Mumbai. They are intelligent and capable guys, but spend their time loafing about the city and swindling unsuspecting people.;MOVIE;181;1980;['thriller', 'action', 'drama', 'crime'];7.1;2776;3.052;6.5
Haseena Maan Jaayegi;An army officer's wife is unsure if the man she is living with is her husband or his look-alike.;MOVIE;165;1968;['drama', 'romance', 'action'];6.7;128;0.6;
The New Daughters of Joshua Cabe;Three young women who posed as the daughters of an elderly homesteader find out that he has been falsely accused of murder, convicted, and sentenced to hang. They hatch a plot to smuggle him out of prison.;MOVIE;80;1976;['western', 'comedy'];6.1;52;0.6;
The Painted Hills;After years of prospecting, Jonathan finally strikes gold. He returns to town only to discover that his partner has since died and left Tommy fatherless. He decides to leave Shep (played by Lassie) with Tommy to cheer him up. Meanwhile, Jonathan's new partner, Lin, isn't interested in sharing the gold, and lures Jonathan to his death. Lassie immediately deduces what's happened, so Lin poisons Lassie. Lassie barely pulls through and pursues Lin to a climactic confrontation where, due to an off-screen accident with some liquid nitrogen, Lin's gun jams.;MOVIE;68;1951;['drama', 'family', 'western'];4.1;1122;3.54;3.7
Winning of the West;A singing territorial ranger (Gene Autry) spots his younger brother in an outlaw gang.;MOVIE;57;1953;['western'];6.4;95;0.871;5
Curse of Bigfoot;A group of high school students on an archaeological dig discover a centuries old mummified body in a sealed cave. Removing the mummy, it soon comes back to life, revealing itself to be an inhuman beast that terrorizes a small California town.;MOVIE;88;1978;['horror'];1.8;683;1.487;1.8
Gamera vs. Gyaos;Unusual volcanic activity in Japan awakens Gyaos, a bloodthirsty flying monster with the power to slice things in half with an ultrasonic ray. While scientists and the military scramble to devise a way to stop this new threat, a young boy forms an alliance with Gamera, a monster no one else seems to trust.;MOVIE;86;1967;['action', 'horror', 'family', 'fantasy', 'scifi'];5;2165;6.011;6.5
The Day That Shook the World;Historical depiction of the events preceding the political murder of Archduke Franz Ferdinand, would-be emperor of the Austro-Hungarian throne, in Sarajevo, June 28, 1914. A World War would start there, that some claim has not yet ended - merely changed fighting grounds once in a while;MOVIE;130;1975;['drama', 'history', 'european'];6.1;281;3.809;6
Winner Take All;The chronicle of an average American housewife who just happens to be addicted to gambling.;MOVIE;96;1975;['drama'];7.3;93;1.738;7
Tattletales;Tattletales is an American game show which first aired on the CBS daytime schedule on February 18, 1974. It was hosted by Bert Convy, with several announcers, including Jack Clark, Gene Wood, Johnny Olson and John Harlan, providing the voiceover at various times.  The show's premise involved questions asked about celebrity couples' personal lives and was based on He Said, She Said, a syndicated Goodson-Todman show that aired during the 1969—1970 season.;SHOW;30;1974;['comedy', 'reality'];7.6;48;0.98;6
Beachhead;On a Japanese-occupied island during World War II, only two soldiers remain alive after a mission attempt goes horribly wrong. Trapped on the island, they must escort a scientist and his daughter to the other side of the island where their ship awaits. They must battle nature, hard terrain, and advancing Japanese troops.;MOVIE;90;1954;['war', 'drama'];5.7;1054;3.309;5.5
Valerie;After the American Civil War, former Union Major John Garth marries pretty settler Valerie but tragedy strikes and the two spouses end up in court where they give two different conflicting accounts of their marriage.;MOVIE;82;1957;['western', 'crime', 'drama'];5.9;352;1.753;3.8
Some Kind of a Nut;A New York City bank teller becomes a media celebrity when he refuses to comply with his employer's demands that he shave his beard.;MOVIE;89;1969;['comedy'];4.3;299;1.33;3.4
Aaron Loves Angela;Aaron and Angela, two young adults living in the Harlem ghetto of New York City, are deeply in love with each other. The only thing standing in the way of their love is their families. Aaron is black, while Angela is Puerto Rican, and neither family wants one of their own to associate with the others. As the pair rebel against the prejudices of their families, they soon find the conflict spreading out to their friends and neighbors, until the hatred threatens to spiral out of control.;MOVIE;99;1975;['romance', 'comedy', 'drama', 'crime', 'thriller'];5.7;265;0.951;2
Giants of Rome;An elite group of soldiers led by the courageous Claudius Marcellus are handpicked by Julius Caesar to embark on a desperate and dangerous suicide mission to destroy the Druids' secret weapon.;MOVIE;95;1964;['drama', 'action', 'war', 'european'];4.9;251;0.955;6
SST: Death Flight;On its maiden flight, the crew of America's first supersonic transport learns that it may not be able to land, due to an act of sabotage and a deadly flu onboard.;MOVIE;89;1977;['thriller', 'drama'];3.9;546;4.128;5.1
The Great St. Louis Bank Robbery;Career criminals (David Clarke, Graham Denton) and a local youth (Steve McQueen) carefully plan and rehearse the robbery of a Missouri bank.;MOVIE;89;1959;['thriller', 'crime', 'drama'];5.8;1496;1.511;6.2
War Italian Style;It's May 1943, and two Italian American soldiers, Joe and Frank, are searching the North African desert for a Nazi general called Von Kassler. Von Kassler's aide captures them, and arranges for them to escape with fake war plans. But, things don't go exactly as planned for either side.;MOVIE;84;1966;['comedy', 'european'];5;211;2.176;4.9
Santa and the Three Bears;Two bear cubs want to meet Santa despite their mother telling them that Santa does not exist. With the help of the park ranger, their wish might come true!;MOVIE;46;1970;['fantasy', 'animation', 'family'];6.7;648;1.904;5.3
Up in the Cellar;A student poet seduces his college president's wife, daughter, and girlfriend over lost financial aid.;MOVIE;94;1970;['comedy', 'romance'];5.2;183;0.84;
The Jesus Trip;When the police discover that their motorcycles are concealing heroin, Waco (Robert Porter) and his motorcycle gang hides out in a desert convent. A highway patrolman (Billy 'Green' Bush) hunts down the gang after they kidnap a nun, Sister Anna (Tippy Walker) and flee the convent. Soon Waco and the young nun fall in love and she is forced to decide whether or not to leave the church for him. (alfiehitchie);MOVIE;84;1971;['drama', 'action'];5.7;92;1.15;7
Superbug, Super Agent;Jimmy Bondi and his miracle beetle Dudu are on their way to Portugal by sea. In the Algarve, they are witness to a dispute in which ex-inmate Plato and the attractive Tamara have to do with Marchese de la Sotta and his henchmen.;MOVIE;91;1972;['comedy'];5.1;305;0.98;4.9
